{
  "$id" : "https://biaffectbridge.github.io/mobile-client-json/schemas/v4/ArchiveMetadata.json",
  "$schema" : "http://json-schema.org/draft-07/schema#",
  "type" : "object",
  "title" : "ArchiveMetadata",
  "description" : "The metadata for an archive that can be zipped using the app developer's choice of third-party archival tools.",
  "definitions" : {
    "FileInfo" : {
      "$id" : "#FileInfo",
      "type" : "object",
      "title" : "FileInfo",
      "description" : "",
      "properties" : {
        "filename" : {
          "type" : "string",
          "description" : "The filename of the archive object. This should be unique within the manifest.",
          "format" : "uri-reference"
        },
        "timestamp" : {
          "type" : "string",
          "description" : "The file creation date.",
          "format" : "date-time"
        },
        "contentType" : {
          "type" : "string",
          "description" : "The content type of the file."
        },
        "identifier" : {
          "type" : "string",
          "description" : "The identifier for the result."
        },
        "stepPath" : {
          "type" : "string",
          "description" : "The full path to the result if it is within the step history."
        },
        "jsonSchema" : {
          "type" : "string",
          "description" : "The uri for the json schema if the content type is 'application/json'.",
          "format" : "uri"
        },
        "metadata" : {
          "description" : "Any additional metadata about this file."
        }
      },
      "required" : [
        "filename",
        "timestamp"
      ],
      "examples" : [
        {
          "filename" : "foo.json",
          "timestamp" : "2024-06-13T11:39:36.436-07:00",
          "contentType" : "application/json",
          "identifier" : "foo",
          "stepPath" : "Bar/foo",
          "jsonSchema" : "http://example.org/schemas/v1/Foo.json",
          "metadata" : {
            "value" : 1
          }
        }
      ]
    }
  },
  "properties" : {
    "appName" : {
      "type" : "string",
      "description" : "Name of the app that built the archive."
    },
    "appVersion" : {
      "type" : "string",
      "description" : "Version of the app that built the archive."
    },
    "deviceInfo" : {
      "type" : "string",
      "description" : "Information about the specific device."
    },
    "deviceTypeIdentifier" : {
      "type" : "string",
      "description" : "Specific model identifier of the device."
    },
    "files" : {
      "type" : "array",
      "description" : "A list of the files included in this archive.",
      "items" : {
        "$ref" : "#/definitions/FileInfo"
      }
    }
  },
  "required" : [
    "appName",
    "appVersion",
    "deviceInfo",
    "deviceTypeIdentifier",
    "files"
  ],
  "examples" : [
    {
      "appName" : "???",
      "appVersion" : "???",
      "deviceInfo" : "Mac Version 14.2.1 (Build 23C71)",
      "deviceTypeIdentifier" : "Mac",
      "files" : [
        {
          "contentType" : "application/json",
          "filename" : "foo.json",
          "identifier" : "foo",
          "jsonSchema" : "https://example.com/foo.json",
          "metadata" : {
            "foo" : "baroo"
          },
          "stepPath" : "Goo/foo",
          "timestamp" : "2017-10-16T22:28:09.000-07:00"
        }
      ]
    }
  ]
}